{
  "id": "tel_w100542_w4_2026",
  "formType": "W4",
  "jurisdiction": {
    "id": "tjur_us_federal",
    "descriptor": "Weekly USD Pay Group"
  },
  "filingStatus": "example",
  "multipleJobs": true,
  "dependentsAmount": 2000.0,
  "otherIncome": 0.0,
  "deductions": 0.0,
  "additionalWithholding": 50.0,
  "effectiveDate": "2026-04-30",
  "submittedOn": "2026-04-30T16:45:00Z",
  "status": "Active"
}
